{
  "vct": "in.bacp.agent.1",
  "iss": "https://registry.example.in",
  "sub": "did:web:agents.vaani.example.in:sakhi",
  "iat": 1792200000,
  "exp": 1807750000,
  "operator": {
    "legal_name": "Vaani Voice Commerce Pvt Ltd",
    "entity_id": {
      "type": "CIN",
      "value": "U72900KA2025PTC000000"
    },
    "grievance_officer": {
      "name": "Grievance Officer",
      "email": "grievance@vaani.example.in",
      "phone": "tel:+91-80-00000000"
    }
  },
  "bap": {
    "subscriber_id": "bap.vaani.example.in",
    "ukid": "ukid-7"
  },
  "agent": {
    "class": "voice_shopping",
    "model_family": "example-llm-2",
    "build": "2026.10.1",
    "channels": [
      "voice",
      "ivr",
      "upi123pay"
    ],
    "languages": [
      "hi-IN",
      "en-IN"
    ]
  },
  "cnf": {
    "jwk": {
      "kty": "OKP",
      "crv": "Ed25519",
      "x": "11qYAYKxCrfVS_7TyWQHOg7hcvPapiMlrwIaaPcHURo",
      "kid": "sakhi-1"
    }
  },
  "purposes": [
    "bacp-browse",
    "bacp-pay",
    "bacp-post-order"
  ],
  "disclosure": {
    "ai_notice": {
      "hi-IN": "आप एक AI सहायक से बात कर रहे हैं।",
      "en-IN": "You are talking to an AI assistant."
    },
    "human_handoff_url": "https://vaani.example.in/human",
    "handoff_routes": [
      {
        "channel": "ivr",
        "uri": "tel:+91-80-00000001",
        "dtmf": "0",
        "languages": [
          "hi-IN",
          "en-IN"
        ],
        "hours": "Mo-Su 08:00-20:00"
      },
      {
        "channel": "web",
        "uri": "https://vaani.example.in/human",
        "languages": [
          "hi-IN",
          "en-IN"
        ],
        "hours": "24x7"
      }
    ],
    "compensation_model": "seller_paid"
  },
  "status": {
    "status_list": {
      "uri": "https://registry.example.in/status/agents/1",
      "idx": 4211
    }
  }
}
